{
    "schema":  "python-slm-phase-evidence-v1",
    "phase_id":  "P1A",
    "run_id":  "20260811T135205572Z-b4054fbd19f3447cbc6cb13e",
    "mode":  "Cpu",
    "status":  "FAIL",
    "started_at":  "2026-08-11T13:52:05.5091714Z",
    "finished_at":  "2026-08-11T13:52:05.8133849Z",
    "duration_ms":  304,
    "invocation":  {
                       "argv":  [
                                    "powershell",
                                    "-NoProfile",
                                    "-ExecutionPolicy",
                                    "Bypass",
                                    "-File",
                                    "scripts/verify-env.ps1",
                                    "-Mode",
                                    "Cpu",
                                    "-OutputRoot",
                                    "docs/receipts/P1A"
                                ],
                       "cwd":  "${REPO}"
                   },
    "source_identity_sha256":  "1d710d0c8df4fc784a06fc562d7413dd2b799be2532a4a55bd4e28eac1ad0c59",
    "p0_dependency":  {
                          "status":  "FAIL",
                          "receipt_commit":  "86fb1e4cc68efeb651e5362c4aca85c2827d8e4d",
                          "receipt_sha256":  "f08c6a41658ff287e238d6a96c4f2c874975964202c3eeced2bc0bc21f308904",
                          "contract_sha256":  "fc2c60b52fdd7c524e0da06bb03972a4d523c21ad5536cba536185435bd44ad4",
                          "decision_ledger_sha256":  "8349d8a3e06d96d6921889de5534715e7b2f7439caf7e06558a97652a8890c8d"
                      },
    "environment":  null,
    "commands":  [

                 ],
    "gates":  {
                  "p0":  {
                             "status":  "FAIL",
                             "detail":  "Cannot process argument transformation on parameter \u0027FilePath\u0027. Cannot convert value to type System.String."
                         },
                  "input_stability":  {
                                          "status":  "NOT_RUN",
                                          "detail":  "not reached"
                                      },
                  "toolchain":  {
                                    "status":  "NOT_RUN",
                                    "detail":  "not reached"
                                },
                  "native_probe":  {
                                       "status":  "NOT_RUN",
                                       "detail":  "not reached"
                                   },
                  "cpu_graph":  {
                                    "status":  "NOT_RUN",
                                    "detail":  "not reached"
                                },
                  "clean_build":  {
                                      "status":  "NOT_RUN",
                                      "detail":  "not reached"
                                  },
                  "quality_gate":  {
                                       "status":  "NOT_RUN",
                                       "detail":  "not reached"
                                   },
                  "python_isolation":  {
                                           "status":  "NOT_RUN",
                                           "detail":  "not reached"
                                       },
                  "cuda_isolation":  {
                                         "status":  "NOT_RUN",
                                         "detail":  "not reached"
                                     },
                  "redaction":  {
                                    "status":  "NOT_RUN",
                                    "detail":  "not reached"
                                },
                  "cleanup":  {
                                  "status":  "NOT_RUN",
                                  "detail":  "not reached"
                              }
              },
    "errors":  [
                   {
                       "code":  "UNEXPECTED_VERIFIER_FAILURE",
                       "category":  1,
                       "message":  "Cannot process argument transformation on parameter \u0027FilePath\u0027. Cannot convert value to type System.String.",
                       "remediation":  "Correct the reported prerequisite or verifier failure, then run the exact P1A command again."
                   }
               ],
    "cleanup":  {
                    "attempted":  true,
                    "temporary_root_removed":  true
                },
    "seal":  {
                 "path":  "SHA256SUMS",
                 "sha256":  "d8de2c38943cdcbd385b8998da919fac0db0ae4abce6f06816e5d4d1a98d7297",
                 "entries":  2,
                 "coverage_rule":  "all_run_files_except_root_evidence_and_seal"
             }
}
